<?xml version="1.0" encoding="utf-8"?>
<!ELEMENT LIMES (PREFIX*, SOURCE, TARGET, METRIC, ACCEPTANCE, REVIEW, EXECUTION*, GRANULARITY*, OUTPUT*)>
<!ELEMENT PREFIX (NAMESPACE, LABEL)>
<!ELEMENT NAMESPACE (#PCDATA)>
<!ELEMENT LABEL (#PCDATA)>
<!ELEMENT SOURCE (ID, ENDPOINT, GRAPH*, VAR, PAGESIZE, RESTRICTION+, PROPERTY+, TYPE*)>
<!ELEMENT TARGET (ID, ENDPOINT, GRAPH*, VAR, PAGESIZE, RESTRICTION+, PROPERTY+, TYPE*)>
<!ELEMENT ID (#PCDATA)>
<!ELEMENT RESTRICTION (#PCDATA)>
<!ELEMENT METRIC (#PCDATA)>
<!ELEMENT ACCEPTANCE (THRESHOLD, FILE, RELATION)>
<!ELEMENT REVIEW (THRESHOLD, FILE, RELATION)>
<!ELEMENT RELATION (#PCDATA)>
<!ELEMENT ENDPOINT (#PCDATA)>
<!ELEMENT GRAPH (#PCDATA)>
<!ELEMENT VAR (#PCDATA)>
<!ELEMENT CLASS (#PCDATA)>
<!ELEMENT PROPERTY (#PCDATA)>
<!ELEMENT TYPE (#PCDATA)>
<!ELEMENT THRESHOLD (#PCDATA)>
<!ELEMENT FILE (#PCDATA)>
<!ELEMENT PAGESIZE (#PCDATA)>
<!ELEMENT EXECUTION (#PCDATA)>
<!ELEMENT GRANULARITY (#PCDATA)>
<!ELEMENT OUTPUT (#PCDATA)>
