<?xml version="1.0" encoding="UTF-8" standalone="no"?>
<!DOCTYPE LIMES
  SYSTEM "limes.dtd">
<LIMES>
   <PREFIX>
      <NAMESPACE>http://www.w3.org/1999/02/22-rdf-syntax-ns#</NAMESPACE>
      <LABEL>rdf</LABEL>
   </PREFIX>
   <PREFIX>
      <NAMESPACE>http://xmlns.com/foaf/0.1/</NAMESPACE>
      <LABEL>foaf</LABEL>
   </PREFIX>
   <PREFIX>
      <NAMESPACE>http://purl.org/collections/nl/am/</NAMESPACE>
      <LABEL>am</LABEL>
   </PREFIX>
   <PREFIX>
      <NAMESPACE>http://purl.org/collections/nl/stadsarchief/</NAMESPACE>
      <LABEL>stads</LABEL>
   </PREFIX>
   <PREFIX>
      <NAMESPACE>http://purl.org/collections/nl/rijksmonumenten/</NAMESPACE>
      <LABEL>rmon</LABEL>
   </PREFIX>
   <PREFIX>
      <NAMESPACE>http://www.w3.org/2002/07/owl#</NAMESPACE>
      <LABEL>owl</LABEL>
   </PREFIX>
   <PREFIX>
      <NAMESPACE>http://www.w3.org/2000/01/rdf-schema#</NAMESPACE>
      <LABEL>rdfs</LABEL>
   </PREFIX>
   <SOURCE>
      <ID>source_a</ID>
      <ENDPOINT>http://semanticweb.cs.vu.nl/europeana/sparql/</ENDPOINT>
      <VAR>?a</VAR>
      <PAGESIZE>1000</PAGESIZE>
      <RESTRICTION>?a rdf:type stads:Person.</RESTRICTION>
      <PROPERTY>foaf:name AS lowercase</PROPERTY>
   </SOURCE>
   <TARGET>
      <ID>source_b</ID>
      <ENDPOINT>http://semanticweb.cs.vu.nl/europeana/sparql/</ENDPOINT>
      <VAR>?b</VAR>
      <PAGESIZE>1000</PAGESIZE>
      <RESTRICTION>?b rdf:type rmon:Person.</RESTRICTION>
      <PROPERTY>rdfs:label AS lowercase</PROPERTY>
   </TARGET>
   <METRIC>trigrams(a.foaf:name, b.rdfs:label)</METRIC>
   <ACCEPTANCE>
      <THRESHOLD>0.7</THRESHOLD>
      <FILE>accept.nt</FILE>
      <RELATION>owl:sameAs</RELATION>
   </ACCEPTANCE>
   <REVIEW>
      <THRESHOLD>0.7</THRESHOLD>
      <FILE>review.nt</FILE>
      <RELATION>owl:sameAs</RELATION>
   </REVIEW>
   <EXECUTION>Simple</EXECUTION>
   <OUTPUT>NT</OUTPUT>
</LIMES>
